region,contract,buyer,supplier,amount,award_date,start_date,end_date,link
Federal,Footwear,National Defence,Distribution Elite Canada inc.,"$23,751","Aug. 2, 2022","Sep. 2, 2022","Sep. 2, 2022",https://theijf.org/procurement/4502459410_dnd
Federal,"Plumbing equipment and fittings, including parts",National Defence,Stelem division Emco corporation,"$16,276","Aug. 2, 2022","Aug. 2, 2022","Dec. 30, 2022",https://theijf.org/procurement/4502459441_dnd
Federal,Tools and implements,National Defence,SNAP-ON,"$14,337","Aug. 2, 2022","Aug. 2, 2022","Aug. 9, 2022",https://theijf.org/procurement/4502459459_dnd
Federal,Footwear,National Defence,Distribution Elite Canada inc.,"$18,803","Aug. 2, 2022","Sep. 2, 2022","Sep. 2, 2022",https://theijf.org/procurement/4502459464_dnd
Federal,Miscellaneous Chemical products,National Defence,Neil Hallett & Sons Ltd,"$24,610","Aug. 2, 2022","Aug. 2, 2022","Aug. 16, 2022",https://theijf.org/procurement/4502459569_dnd
Federal,Aviation fuel,National Defence,Harnois Energies,"$78,004","Aug. 2, 2022","Aug. 2, 2022","Aug. 10, 2022",https://theijf.org/procurement/4502459618_dnd
Federal,Other buildings,National Defence,Cossey Corporation,"$12,682","Aug. 2, 2022","Aug. 2, 2022","Dec. 7, 2022",https://theijf.org/procurement/4502459626_dnd
Federal,Other buildings,National Defence,Big T Trucking,"$10,753","Aug. 2, 2022","Aug. 2, 2022","Sep. 13, 2022",https://theijf.org/procurement/4502459809_dnd
Federal,Other buildings,National Defence,GATEWAY MECHANICAL,"$14,205","Aug. 2, 2022","Aug. 2, 2022","Mar. 31, 2023",https://theijf.org/procurement/4502459916_dnd
Federal,Other Business services not Elsewhere Specified,National Defence,Shortgrass Ecosystems,"$11,756","Aug. 2, 2022","Aug. 2, 2022","Nov. 3, 2022",https://theijf.org/procurement/4502460304_dnd
Federal,Aviation fuel,National Defence,Exxonmobil,"$54,509","Aug. 2, 2022","Aug. 2, 2022","Aug. 5, 2022",https://theijf.org/procurement/4502461043_dnd
Federal,Road Motor Vehicles,Parks Canada,Ford Motor Company of Canada Ltd.,"$49,804","Aug. 2, 2022","Aug. 2, 2022","Aug. 9, 2022",https://theijf.org/procurement/45451487_pc
Federal,Sewer and Water,Parks Canada,RYAN SCOTT,"$25,510","Aug. 2, 2022","Aug. 2, 2022","Aug. 12, 2022",https://theijf.org/procurement/45451489_pc
Federal,Communications Networking Equipment,Parks Canada,Wi-Com Solutions Inc.,"$30,169","Aug. 2, 2022","Aug. 2, 2022","Aug. 31, 2023",https://theijf.org/procurement/45451499_pc
Federal,Engineering Consultants - Other,Parks Canada,WSP Canada Inc.,"$401,182","Aug. 2, 2022","Aug. 2, 2022","Mar. 31, 2024",https://theijf.org/procurement/45451500_pc
Federal,"Other Mineral Fuels, Oils and Products",Parks Canada,Parkland Corporation,"$12,892","Aug. 2, 2022","Aug. 2, 2022","Mar. 31, 2023",https://theijf.org/procurement/45451511_pc
Federal,"Highways, Roads and Streets",Parks Canada,RYZUK GEOTECHNICAL LTD.,"$11,550","Aug. 2, 2022","Aug. 2, 2022","Oct. 31, 2022",https://theijf.org/procurement/45451521_pc
Federal,Rental of Aircraft,Parks Canada,Phoenix Heli-Flight Inc,"$93,576","Aug. 2, 2022","Aug. 2, 2022","Oct. 1, 2022",https://theijf.org/procurement/45451522_pc
Federal,"Other Mineral Fuels, Oils and Products",Parks Canada,Parkland Corporation,"$10,487","Aug. 2, 2022","Aug. 2, 2022","Mar. 31, 2023",https://theijf.org/procurement/45451604_pc
Federal,No name provided,Fisheries and Oceans Canada,PRICEWATERHOUSECOOPERS,$0,"Aug. 2, 2022","Aug. 2, 2022","Jun. 30, 2025",https://theijf.org/procurement/4600000363_dfo
Federal,License/Maintenance fees for application software (including COTS) and application development and delivery software,Military Grievances External Review Committee,"Itex Inc..,DBA Technology","$10,581","Aug. 2, 2022","Aug. 2, 2022","Aug. 1, 2023",https://theijf.org/procurement/4612314197_mgerc
Federal,Office Furniture and Other Equipment Repairs and Maintenance,Canada Border Services Agency,Smiths Detection Montreal Inc.,"$398,883","Aug. 25, 2022","Aug. 2, 2022","Jul. 31, 2023",https://theijf.org/procurement/4741922399_cbsa
Federal,Office Furniture and Other Equipment Repairs and Maintenance,Canada Border Services Agency,Smiths Detection Montreal Inc.,"$413,373","Aug. 25, 2022","Aug. 2, 2022","Jul. 31, 2023",https://theijf.org/procurement/4741922401_cbsa
Federal,Management consulting,"Innovation, Science and Economic Development Canada",ACOSYS CONSULTING SERVICES INC.,"$18,069","Aug. 2, 2022","Aug. 2, 2022","Mar. 31, 2023",https://theijf.org/procurement/5031090_ic
Federal,Interpretation services,Immigration and Refugee Board of Canada,"WANG, ZHONG GONG (PAUL)","$21,000","Aug. 2, 2022","Aug. 2, 2022","Aug. 1, 2024",https://theijf.org/procurement/6040139_irb
Federal,Other professional services not elsewhere specified,National Film Board,AKUFEN ATELIER CREATIF INC,"$74,734","Aug. 2, 2022","Aug. 2, 2022","Mar. 31, 2023",https://theijf.org/procurement/6040212_nfb
Federal,Communications professional services not elsewhere specified,Social Sciences and Humanities Research Council of Canada,Resolve Collaboration Services,"$37,229","Aug. 2, 2022","Aug. 2, 2022","Jun. 30, 2023",https://theijf.org/procurement/6043558_sshrc
Federal,Engineering Services not Elsewhere Specified,Public Services and Procurement Canada,Dillon Consulting Limited,"$37,835","Aug. 2, 2022","Aug. 2, 2022","Mar. 30, 2023",https://theijf.org/procurement/700664814_pwgsc
Federal,"Printed Matter, Includ Books, Newspapers, Pictures",Public Services and Procurement Canada,Kromar Printing Limited,"$41,895","Aug. 2, 2022","Aug. 2, 2022","Sep. 30, 2022",https://theijf.org/procurement/700665131_pwgsc
Federal,Other professional services not elsewhere specified,Public Services and Procurement Canada,Arcadis Canada Inc.,"$85,398","Nov. 3, 2022","Aug. 2, 2022","Mar. 31, 2023",https://theijf.org/procurement/700665157_pwgsc
Federal,Office Buildings,Public Services and Procurement Canada,12072467 Canada Inc.,"$39,550","Aug. 2, 2022","Aug. 2, 2022","Mar. 31, 2023",https://theijf.org/procurement/700665179_pwgsc
Federal,Other Engineering Works,Public Services and Procurement Canada,Stantec Consulting Ltd.,"$27,690","Aug. 2, 2022","Aug. 2, 2022","Mar. 31, 2023",https://theijf.org/procurement/700665456_pwgsc
Federal,"Repair and maintenance - Measuring, controlling, laboratory, medical and optical instruments, apparatus and accessories",Canadian Space Agency,KEYSIGHT TECHNOLOGIES CANADA INC,"$17,802","Aug. 2, 2022","Aug. 2, 2022","Sep. 29, 2022",https://theijf.org/procurement/7015830_csa
Federal,Other professional services not elsewhere specified,Canadian Space Agency,CORPS CANADIEN DES COMMISSIONNAIRES,"$38,647","Aug. 2, 2022","Aug. 2, 2022","Feb. 28, 2023",https://theijf.org/procurement/7015831_csa
Federal,Management consulting,"Immigration, Refugees and Citizenship Canada",VERITAAQ TECHNOLOGY HOUSE/EXPERIS,"$134,866","Aug. 2, 2022","Aug. 2, 2022","Dec. 31, 2022",https://theijf.org/procurement/7117245_cic
Federal,Information technology and telecommunications consultants,"Immigration, Refugees and Citizenship Canada",KYNDRYL CANADA,"$510,094","Aug. 2, 2022","Aug. 2, 2022","May 16, 2023",https://theijf.org/procurement/7117321_cic
Federal,Information technology and telecommunications consultants,"Immigration, Refugees and Citizenship Canada",ADRM TECHNOLOGY CONSULTING GROUP CO,"$37,209","Aug. 2, 2022","Sep. 8, 2022","Mar. 31, 2023",https://theijf.org/procurement/7117437_cic
Federal,Information technology and telecommunications consultants,Royal Canadian Mounted Police,CORADIX TECHNOLOGY CONSULTING LTD.,"$248,148","Aug. 2, 2022","Aug. 2, 2022","Mar. 7, 2024",https://theijf.org/procurement/7258983_rcmp
Federal,Other Business services not Elsewhere Specified,Royal Canadian Mounted Police,PRICE WATERHOUSE COOPERS LLP,"$347,014","Aug. 2, 2022","Aug. 8, 2022","Mar. 31, 2023",https://theijf.org/procurement/7259070_rcmp
Federal,Other Business services not Elsewhere Specified,Royal Canadian Mounted Police,BELL CANADA/BELL NEXXIA,"$288,177","Aug. 2, 2022","Aug. 2, 2022","Mar. 31, 2023",https://theijf.org/procurement/7259105_rcmp
Federal,"Communications/Networking equipment (includes analog, digital and combined analog/digital equipment, cabling, parts and peripherals)",Royal Canadian Mounted Police,GRAYBAR CANADA,"$31,329","Aug. 2, 2022","Aug. 2, 2022","Sep. 30, 2022",https://theijf.org/procurement/7259156_rcmp
Federal,Aircraft parts,Royal Canadian Mounted Police,LEVAERO AVIATION INC,"$25,150","Aug. 2, 2022","Aug. 2, 2022","Sep. 9, 2022",https://theijf.org/procurement/7259158_rcmp
Federal,"Communications/Networking equipment (includes analog, digital and combined analog/digital equipment, cabling, parts and peripherals)",Royal Canadian Mounted Police,MEGA-TECH,"$198,135","Aug. 2, 2022","Aug. 2, 2022","Oct. 3, 2022",https://theijf.org/procurement/7259162_rcmp
Federal,Other Institutional buildings,Royal Canadian Mounted Police,PCL CONSTRUCTION MANAGEMENT INC.,"$2,177,196","Aug. 2, 2022","Aug. 2, 2022","May 31, 2024",https://theijf.org/procurement/7259166_rcmp
Federal,Other health services not elsewhere specified,Royal Canadian Mounted Police,CALIAN,"$116,983","Aug. 2, 2022","Aug. 2, 2022","Jun. 30, 2023",https://theijf.org/procurement/7259747_rcmp
Federal,Public relations services,Global Affairs Canada,FinTech Sandbox,"$12,879","Aug. 2, 2022","Sep. 27, 2022","Sep. 29, 2022",https://theijf.org/procurement/7442309_dfatd
Federal,Management consulting,Global Affairs Canada,"METIS LIGHTHOUSE,LLC","$92,730","Aug. 2, 2022","Aug. 3, 2022","Dec. 31, 2023",https://theijf.org/procurement/7442310_dfatd
Federal,Residential buildings,Global Affairs Canada,Omega Sławomir Ozimek,"$17,715","Aug. 2, 2022","Aug. 10, 2022","Aug. 31, 2022",https://theijf.org/procurement/7442320_dfatd
Federal,License/Maintenance fees for networking software,Global Affairs Canada,Forest Economic Advisors,"$24,617","Aug. 2, 2022","Aug. 2, 2022","Jun. 30, 2023",https://theijf.org/procurement/7442321_dfatd
Federal,Transportation of things not elsewhere specified,Global Affairs Canada,BOLLORE LOGISTICS,"$22,049","Aug. 2, 2022","Aug. 2, 2022","Aug. 2, 2022",https://theijf.org/procurement/7442334_dfatd
Federal,Management consulting,Global Affairs Canada,CROSS GROUP,"$19,238","Aug. 2, 2022","Aug. 2, 2022","Mar. 31, 2023",https://theijf.org/procurement/7442335_dfatd
Federal,"Rental of image/video communications equipment (includes telepresence/video conferencing equipment, cabling, parts and peripherals)",Global Affairs Canada,Encore Global Events (Canada),"$17,850","Aug. 2, 2022","Aug. 2, 2022","Aug. 31, 2022",https://theijf.org/procurement/7442336_dfatd
Federal,Architectural services,Global Affairs Canada,Robertson Martin Architects,"$131,911","Aug. 2, 2022","Aug. 2, 2022","Aug. 31, 2023",https://theijf.org/procurement/7442338_dfatd
Federal,Engineering consultants - Construction,Global Affairs Canada,Kida Design Inc.,"$1,137,000","Aug. 2, 2022","Aug. 2, 2022","Aug. 31, 2023",https://theijf.org/procurement/7442339_dfatd
Federal,Engineering consultants - Construction,Global Affairs Canada,J.L. RICHARDS & ASSOCIATES LTD,"$252,348","Aug. 2, 2022","Aug. 2, 2022","Dec. 31, 2023",https://theijf.org/procurement/7442342_dfatd
Federal,Services related to the assessment of potentially contaminated sites,"Innovation, Science and Economic Development Canada",TERRAPEX ENVIRONMENTAL LTD.,"$15,376","Aug. 2, 2022","Aug. 2, 2022","Dec. 30, 2022",https://theijf.org/procurement/7501149_ic
Federal,Office buildings,"Innovation, Science and Economic Development Canada",CLOUTHIER CUSTOM CARPENTRY INC,"$46,161","Aug. 2, 2022","Aug. 2, 2022","Nov. 30, 2022",https://theijf.org/procurement/7501151_ic
Federal,Other buildings,National Defence,Rolling Tides Construction,"$478,415","Aug. 2, 2022","Aug. 2, 2022","Sep. 30, 2023",https://theijf.org/procurement/78416_es004462_pe000203_dnd
Federal,Application software (including COTS) and application development and delivery software,Natural Resources Canada,SALESFORCE.COM CANADA CORPORATION,"$203,047","Aug. 2, 2022","Aug. 2, 2022","Aug. 2, 2022",https://theijf.org/procurement/80005122_nrcan
Federal,Computer equipment related to distributed computing environment (DCE)-Desktop/personal/portable (includes all related parts and,Environment and Climate Change Canada,TELECOM COMPUTER INC.,"$12,300","Aug. 2, 2022","Aug. 2, 2022","Feb. 15, 2023",https://theijf.org/procurement/80005124_ec
Federal,Research contracts,Canadian Radio-television and Telecommunications Commission,Sheffe Consulting.,"$28,088","Aug. 2, 2022","Aug. 2, 2022","Dec. 30, 2022",https://theijf.org/procurement/8053351_crtc
Federal,Computer equipment related to Distributed Computing Environment (DCE) - Desktop/personal/portable (includes all related parts and peripherals),National Film Board,SOFTCHOICE CORPORATION,"$13,698","Aug. 2, 2022","Aug. 2, 2022","Mar. 31, 2023",https://theijf.org/procurement/8053385_nfb
Federal,Miscellaneous manufactured articles,Privy Council Office,RIDEAU RECOGNITION SOLUTIONS INC.,"$36,643","Aug. 2, 2022","Aug. 2, 2022","Aug. 1, 2023",https://theijf.org/procurement/8053387_pco
Federal,"Image/Video communications equipment (includes telepresence/video conferencing equipment, cabling, parts and peripherals)",Office of the Superintendent of Financial Institutions Canada,POLYCOM CANADA INC,"$16,083","Aug. 2, 2022","Aug. 2, 2022","Nov. 1, 2022",https://theijf.org/procurement/8053395_osfi
Federal,Information Technology Consultants,"Innovation, Science and Economic Development Canada",VERITAAQ TECHNOLOGY HOUSE INC.,"$113,247","Aug. 2, 2022","Aug. 2, 2022","Feb. 20, 2023",https://theijf.org/procurement/8510118_ic
Federal,Purchase of training packages and courses,National Research Council Canada,10353868 CANADA INC.,"$85,315","Aug. 2, 2022","Aug. 2, 2022","Mar. 31, 2023",https://theijf.org/procurement/993722_nrc
Federal,Services related to the remediation of contaminated sites,National Research Council Canada,STANTEC CONSULTING LTD.,"$103,170","Aug. 2, 2022","Aug. 2, 2022","Jun. 30, 2023",https://theijf.org/procurement/993750_nrc
Federal,Services related to the remediation of contaminated sites,National Research Council Canada,CULLIGAN OTTAWA WATER CONDITIONING,"$55,947","Aug. 2, 2022","Aug. 2, 2022","Mar. 31, 2023",https://theijf.org/procurement/993751_nrc
Federal,"Meat, fish and their preparations",National Defence,SYSCO,"$18,313","Aug. 2, 2022","Aug. 3, 2022","Aug. 3, 2022",https://theijf.org/procurement/an0134202300233_dnd
Federal,AIRCRAFT,Transport Canada,MID CANADA MOD CENTER,"$10,786","Aug. 2, 2022","Aug. 2, 2022","Sep. 2, 2022",https://theijf.org/procurement/asr_2193_044020_tc
Federal,"Meat, fish and their preparations",National Defence,SYSCO FOOD SERVICES OF ONTARIO,"$11,516","Aug. 2, 2022","Aug. 3, 2022","Aug. 3, 2022",https://theijf.org/procurement/ax0113202301329_dnd
Federal,"Meat, fish and their preparations",National Defence,LES ALIMENTS GUY CHICOINE INC.,"$19,117","Aug. 2, 2022","Aug. 9, 2022","Aug. 9, 2022",https://theijf.org/procurement/by3380202301035_dnd
Federal,"Miscellaneous food, food materials and food preparations",National Defence,GORDON FOOD SERVICES PRAIRIES INC.,"$11,500","Aug. 2, 2022","Aug. 3, 2022","Aug. 3, 2022",https://theijf.org/procurement/ca0168202300241_dnd
Federal,"Meat, fish and their preparations",National Defence,SYSCO,"$14,410","Aug. 2, 2022","Aug. 5, 2022","Aug. 5, 2022",https://theijf.org/procurement/ca0168202300242_dnd
Federal,Other Business services not Elsewhere Specified,National Defence,COMPASS GROUP CANADA LTD.,"$151,565","Aug. 2, 2022","Aug. 2, 2022","Aug. 2, 2022",https://theijf.org/procurement/ca3010202300010_dnd
Federal,Management consulting,Employment and Social Development Canada,CLOSEREACH LTD.,"$316,252","Aug. 9, 2022","Aug. 2, 2022","May 31, 2023",https://theijf.org/procurement/g929221854_esdc
Federal,"Meat, fish and their preparations",National Defence,MULDER MEATS (1983),"$17,622","Aug. 2, 2022","Aug. 3, 2022","Aug. 3, 2022",https://theijf.org/procurement/jy0105202300651_dnd
Federal,Other Business services not Elsewhere Specified,National Defence,Pinchin Ltd,"$23,062","Aug. 2, 2022","Apr. 1, 2024","Mar. 31, 2025",https://theijf.org/procurement/kn74524_4502731192_dnd
Federal,Tuition fees and costs of attending courses including seminars not elsewhere specified,Shared Services Canada,FAST FORWARD FRENCH INC.,"$27,000","Aug. 2, 2022","Aug. 2, 2022","Nov. 18, 2022",https://theijf.org/procurement/p000038833_ssc
Federal,Information technology and telecommunications consultants,Shared Services Canada,9421-5340 QUÉBEC INC.,"$39,619","Aug. 2, 2022","Aug. 2, 2022","Mar. 31, 2023",https://theijf.org/procurement/p000039282_ssc
Federal,Information technology and telecommunications consultants,Shared Services Canada,BLU BONSAI INCORPORATED,"$37,855","Aug. 2, 2022","Aug. 2, 2022","Mar. 31, 2023",https://theijf.org/procurement/p000039283_ssc
Federal,"Computer equipment related to production and operations (P&O) environment-All servers, storage, printers, etc. (includes all related parts and peripherals)",Shared Services Canada,NORTHERN MICRO INC.,"$662,821","Aug. 2, 2022","Aug. 2, 2022","Aug. 1, 2027",https://theijf.org/procurement/p000039374_ssc
Federal,"Computer equipment related to production and operations (P&O) environment-All servers, storage, printers, etc. (includes all related parts and peripherals)",Shared Services Canada,HEWLETT PACKARD ENTERPRISE CANADA C,"$45,768","Aug. 2, 2022","Aug. 18, 2022","Aug. 18, 2027",https://theijf.org/procurement/p000039792_ssc
Federal,1283 Computer Equipment - Client Computing Domain - Desktop/Personal/Portable (includes related parts and peripherals),Parole Board of Canada,DynaBook Canada Inc.,"$100,505","Aug. 2, 2022","Aug. 2, 2022","Sep. 30, 2022",https://theijf.org/procurement/p2300094_pbc
Federal,Image/video equipment,Atlantic Canada Opportunities Agency,Solotech Inc.,"$21,276","Aug. 2, 2022","Aug. 2, 2022","Mar. 31, 2023",https://theijf.org/procurement/p2300227_acoa
Federal,MANAGEMENT CONSULTING SERVICES,Transport Canada,INDIGENUITY CONSULTING GROUP INC,"$71,991","Aug. 2, 2022","Aug. 2, 2022","Mar. 31, 2024",https://theijf.org/procurement/t7020_220023_tc
Federal,SCIENTIFIC SERVICES,Transport Canada,ALLSALT MARITIME CORPORATION,"$111,969","Aug. 2, 2022","Aug. 2, 2022","Mar. 31, 2023",https://theijf.org/procurement/t8009_220097_tc
Federal,MANAGEMENT CONSULTING SERVICES,Transport Canada,HUMAN POTENTIAL CONSULTANTS INC.,"$30,268","Aug. 2, 2022","Aug. 2, 2022","Oct. 17, 2022",https://theijf.org/procurement/t8080_220029_1_tc
Federal,INFORMATION TECHNOLOGY AND TELECOMMUNICATIONS CONSULTANTS,Transport Canada,IBISKA TELECOM INC.,"$141,851","Aug. 2, 2022","Aug. 2, 2022","Mar. 14, 2024",https://theijf.org/procurement/t8086_172044_001_31_tc
Federal,INFORMATION TECHNOLOGY AND TELECOMMUNICATIONS CONSULTANTS,Transport Canada,IBISKA TELECOM INC.,"$141,432","Aug. 2, 2022","Aug. 2, 2022","Mar. 14, 2024",https://theijf.org/procurement/t8086_172044_001_32_tc
Federal,"ROADS, HIGHWAYS AND AIRPORT RUNWAYS",Transport Canada,PMG TECHNOLOGIES INC.,"$521,706","Aug. 2, 2022","Aug. 2, 2022","Mar. 31, 2023",https://theijf.org/procurement/t8127_220010_tc
Federal,Other machinery and parts,National Defence,Acklands Grainger,"$62,953","Aug. 2, 2022","Aug. 2, 2022","Jan. 23, 2023",https://theijf.org/procurement/w0103_4502457363_dnd
Federal,Pharmaceutical and other medicinal products,National Defence,McKesson,"$14,747","Aug. 2, 2022","Aug. 2, 2022","Aug. 3, 2022",https://theijf.org/procurement/w010h3a160_dnd
Federal,Other professional services not elsewhere specified,National Defence,QMR Staffing Solutions Inc.,"$26,397","Aug. 2, 2022","Sep. 30, 2022","Sep. 30, 2022",https://theijf.org/procurement/w0117_22_chip_dnd
Federal,Other equipment and Parts,National Defence,LE GROUPE MASTER INC,"$13,356","Aug. 2, 2022","Aug. 2, 2022","Sep. 12, 2022",https://theijf.org/procurement/w0130_4502456944_dnd
Federal,Lubricating fuel and greases,National Defence,STAR AUTO & INDUSTRIAL LTD,"$11,692","Aug. 2, 2022","Aug. 2, 2022","Dec. 1, 2022",https://theijf.org/procurement/w0134_23l008_dnd
Federal,Aviation fuel,National Defence,IMPERIAL OIL,"$623,077","Aug. 2, 2022","Aug. 2, 2022","Aug. 31, 2022",https://theijf.org/procurement/w0134_4502459463_dnd
Federal,Diesel fuel,National Defence,PARKLAND CORPORATION,"$34,454","Aug. 2, 2022","Aug. 2, 2022","Aug. 3, 2022",https://theijf.org/procurement/w0142_4502459636_dnd
Federal,"Office furniture and furnishings, including parts",National Defence,Quality Furniture 872312 N.W.T Ltd,"$15,808","Aug. 2, 2022","Aug. 2, 2022","Oct. 5, 2022",https://theijf.org/procurement/w1568_4502459730_dnd
Federal,Heavy fuel oil,National Defence,Irving Oil Limited,"$283,786","Aug. 2, 2022","Aug. 3, 2022","Aug. 3, 2022",https://theijf.org/procurement/w307b3b002_dnd
Federal,Tuition fees and costs of attending courses including seminars not elsewhere specified,National Defence,Northern Ontario School of Medicine,"$387,500","Aug. 2, 2022","Aug. 2, 2022","Jun. 30, 2023",https://theijf.org/procurement/w6369_23_a015_dnd
Federal,Tuition fees and costs of attending courses including seminars not elsewhere specified,National Defence,University of British Columbia,"$62,880","Aug. 2, 2022","Aug. 2, 2022","Jun. 30, 2023",https://theijf.org/procurement/w6369_23_a017_dnd
Federal,Office buildings,National Defence,Setanta Contracting Ltd,"$67,287","Aug. 2, 2022","Aug. 2, 2022","Sep. 2, 2022",https://theijf.org/procurement/w684e_4502459531_dnd
Federal,Other equipment and Parts,National Defence,Bardon Supplies,"$15,885","Aug. 2, 2022","Aug. 2, 2022","Sep. 15, 2022",https://theijf.org/procurement/w6854_4502459644_dnd
Federal,Miscellaneous Chemical products,National Defence,CLARIANT (CANADA) INC,"$13,176","Aug. 2, 2022","Aug. 2, 2022","Nov. 30, 2022",https://theijf.org/procurement/w6856_4502459478_dnd
Federal,Other buildings,National Defence,Webster Electric Ltd,"$20,337","Aug. 2, 2022","Aug. 2, 2022","Aug. 31, 2022",https://theijf.org/procurement/w6862_4502459511_dnd
Federal,Other equipment,National Defence,Fisher Scientific,"$31,469","Aug. 2, 2022","Aug. 2, 2022","Mar. 31, 2023",https://theijf.org/procurement/w7702_226338_dnd
Federal,License/Maintenance fees for application software (including COTS) and application development and delivery software,National Defence,VMWare,"$93,500","Aug. 2, 2022","Sep. 1, 2022","Nov. 30, 2022",https://theijf.org/procurement/w8484_230297_dnd
Federal,License/Maintenance fees for application software (including COTS) and application development and delivery software,National Defence,Close Reach,"$311,990","Aug. 2, 2022","Aug. 2, 2022","Jul. 28, 2023",https://theijf.org/procurement/w8484_230309_dnd
Federal,Other professional services not elsewhere specified,National Defence,Valcom Consulting Group Inc.,"$320,560","Aug. 2, 2022","Aug. 2, 2022","Aug. 31, 2025",https://theijf.org/procurement/w8486_228393_001_qe_dnd
Federal,Ammunition,National Defence,Dummy Ammo Canada,"$22,996","Aug. 2, 2022","Aug. 2, 2022","Mar. 1, 2023",https://theijf.org/procurement/w8486_238651_001_ae_dnd
Federal,Aviation fuel,National Defence,IRVING,"$18,145","Aug. 3, 2022","Aug. 3, 2022","Aug. 3, 2022",https://theijf.org/procurement/0102mn16863658_dnd
Federal,"Image/Video Equipment (Expenditures > $ 10,000 per unit)",Canada Border Services Agency,Delco Automation Inc.,"$191,698","Aug. 3, 2022","Aug. 3, 2022","Mar. 31, 2023",https://theijf.org/procurement/2023013250_cbsa
Federal,Information technology and telecommunications consultants,Canada Revenue Agency,Veritaaq Technology House Inc.,"$144,064","Aug. 3, 2022","Aug. 17, 2022","Apr. 28, 2023",https://theijf.org/procurement/2023013266_cra
Federal,Tuition fees/costs-courses not elsewhere specified,Canada Border Services Agency,Encore Global events (Canada) ULC,"$14,180","Dec. 1, 2022","Aug. 3, 2022","Dec. 31, 2022",https://theijf.org/procurement/2023028332_cbsa
Federal,Aviation fuel,National Defence,SHELL,"$28,380","Aug. 3, 2022","Aug. 3, 2022","Aug. 3, 2022",https://theijf.org/procurement/2106912478_dnd
Federal,Aviation fuel,National Defence,AEG FUELS,"$17,969","Aug. 3, 2022","Aug. 3, 2022","Aug. 3, 2022",https://theijf.org/procurement/2106945949_dnd
Federal,Pharmaceutical and Other Medicinal Products,Correctional Service of Canada,MCKESSON CANADA CORPORATION,"$18,398","Aug. 3, 2022","Aug. 3, 2022","Aug. 10, 2022",https://theijf.org/procurement/21301_23_4182732_csc
Federal,"Miscellaneous Food, Food Materials and Food Preparations, Including Beverages and Tobacco",Correctional Service of Canada,ALIMENTS CHICOINE INC,"$13,209","Aug. 3, 2022","Aug. 3, 2022","Aug. 8, 2022",https://theijf.org/procurement/21307_23_4181991_csc
Federal,Pharmaceutical and Other Medicinal Products,Correctional Service of Canada,MCKESSON CANADA CORPORATION,"$20,493","Aug. 3, 2022","Aug. 3, 2022","Aug. 31, 2022",https://theijf.org/procurement/21401_23_4182730_csc
Federal,Institutional Buildings,Correctional Service of Canada,DOCK PRODUCTS CANADA INC,"$32,770","Aug. 3, 2022","Aug. 30, 2022","Mar. 31, 2023",https://theijf.org/procurement/21407_23_4181714_csc
Federal,Physicians and Surgeons,Correctional Service of Canada,CIMBURA JACQUELINE,"$25,000","Aug. 3, 2022","Aug. 3, 2022","Oct. 31, 2022",https://theijf.org/procurement/21423_23_4182674_csc
Federal,"Heating, Air-conditioning and Refrigeration Equipment",Correctional Service of Canada,BARGREEN ELLINGSON INC,"$33,333","Aug. 3, 2022","Aug. 3, 2022","Aug. 31, 2022",https://theijf.org/procurement/21441_23_4175713_csc
Federal,"Inorganic and Organic Chemicals, Including Plastics, Rubber and Products, and Excluding Tires and Tubes",Correctional Service of Canada,KEMIRA WATER SOLUTIONS CANADA INC,"$13,361","Aug. 3, 2022","Aug. 3, 2022","Mar. 31, 2023",https://theijf.org/procurement/21450_23_4177596_csc
Federal,Other Equipment,Correctional Service of Canada,DRAPEAU AUTOMATIC SPRINKLER CORP,"$11,369","Aug. 3, 2022","Aug. 3, 2022","Aug. 31, 2022",https://theijf.org/procurement/21451_23_4166734_csc
