region,contract,buyer,supplier,amount,award_date,start_date,end_date,link
Federal,"Computer equipment related to production and operations (P&O) environment-All servers, storage, printers, etc. (includes all related parts and peripherals)",Shared Services Canada,THE BELL TELEPHONE COMPANY OF,"$8,002,473","Mar. 4, 2021","Mar. 4, 2021","Mar. 3, 2027",https://theijf.org/procurement/p000040172_ssc
Federal,Tuition fees and costs of attending courses including seminars not elsewhere specified,Atlantic Canada Opportunities Agency,Language Research Development Group Inc. / Ecole de langues de l'Estrie Inc.,"$56,063","Mar. 4, 2021","Mar. 4, 2021","Mar. 3, 2022",https://theijf.org/procurement/p2100211_acoa
Federal,Management Consulting Services,Office of the Auditor General of Canada,S.I. SYSTEMS PARTNERSHIP,"$110,345","Mar. 4, 2021","Mar. 5, 2021","Sep. 30, 2021",https://theijf.org/procurement/p2100320_oag
Federal,Communications professional services ,Prairies Economic Development Canada,CNW Group Ltd.,"$16,046","Mar. 4, 2021","Apr. 1, 2021","Mar. 31, 2022",https://theijf.org/procurement/p2200001_prairiescan
Federal,Communications professional services not elsewhere specified,Prairies Economic Development Canada,Meltwater News Canada Inc.,"$19,210","Mar. 4, 2021","Apr. 1, 2021","Mar. 31, 2022",https://theijf.org/procurement/p2200003_prairiescan
Federal,Translation services,Prairies Economic Development Canada,Fox Translations Ltd.,"$56,500","Mar. 4, 2021","Apr. 1, 2021","Mar. 31, 2022",https://theijf.org/procurement/p2200004_prairiescan
Federal,Translation services,Prairies Economic Development Canada,"Gregoire, Pascale","$39,550","Mar. 4, 2021","Apr. 1, 2021","Mar. 31, 2022",https://theijf.org/procurement/p2200005_prairiescan
Federal,Translation services,Prairies Economic Development Canada,Lionbridge Ltd.,"$67,800","Mar. 4, 2021","Apr. 1, 2021","Mar. 31, 2022",https://theijf.org/procurement/p2200006_prairiescan
Federal,Accounting and Audit services,Office of the Auditor General of Canada,ERNST & YOUNG LLP,"$16,950","Mar. 4, 2021","Apr. 1, 2021","Mar. 31, 2022",https://theijf.org/procurement/p2200022_oag
Federal,Computer equipment-Client computing domain,Health Canada,PURESPIRIT SOLUTIONS INC,"$42,057","Mar. 4, 2021","Mar. 4, 2021","Mar. 31, 2021",https://theijf.org/procurement/r2059160_hc
Federal,Client software related to Distributed Computing Environment (DCE),Royal Canadian Mounted Police,EMPOWERED NETWORKS INC.,"$33,872","Mar. 4, 2021","Mar. 4, 2021","Mar. 31, 2021",https://theijf.org/procurement/s202103917_rcmp
Federal,Computer equipment related to distributed computing environment (DCE)-Desktop/personal/portable (includes all related parts and peripherals),Royal Canadian Mounted Police,TELECOM COMPUTER,"$19,958","Mar. 4, 2021","Mar. 4, 2021","Mar. 12, 2021",https://theijf.org/procurement/s202105031_rcmp
Federal,Information technology and telecommunications consultants,Social Sciences and Humanities Research Council of Canada,Strauss Jay,"$38,965","Mar. 4, 2021","Apr. 1, 2021","Mar. 31, 2022",https://theijf.org/procurement/s22_18925_sshrc
Federal,Information technology and telecommunications consultants,National Defence,Microsoft Canada,"$1,572,395","Mar. 4, 2021","Mar. 4, 2021","Oct. 23, 2023",https://theijf.org/procurement/so_3219_dnd
Federal,Computer equipment related to distributed computing environment (DCE)-Desktop/personal/portable (includes all related parts and peripherals),National Defence,ACT Inc,"$17,362","Mar. 4, 2021","Mar. 4, 2021","Mar. 4, 2021",https://theijf.org/procurement/ssc_61931_dnd
Federal,OTHER BUSINESS SERVICES NOT ELSEWHERE SPECIFIED,Transport Canada,MACKENZIE SEA SERVICES LTD,"$10,815","Mar. 4, 2021","Mar. 4, 2021","Mar. 31, 2021",https://theijf.org/procurement/t1926_20_0017_tc
Federal,ROAD MOTOR VEHICLES,Transport Canada,METRO CHRYSLER DODGE JEEP LTD.,"$76,926","Mar. 4, 2021","Mar. 4, 2021","Mar. 31, 2021",https://theijf.org/procurement/t8009_200442_tc
Federal,INFORMATION TECHNOLOGY AND TELECOMMUNICATIONS CONSULTANTS,Transport Canada,DELOITTE INC,"$39,550","Mar. 4, 2021","Mar. 5, 2021","Mar. 31, 2021",https://theijf.org/procurement/t8080_200712_tc
Federal,INFORMATION TECHNOLOGY AND TELECOMMUNICATIONS CONSULTANTS,Transport Canada,TEKSYSTEMS,"$139,764","Mar. 4, 2021","Apr. 1, 2021","Oct. 31, 2021",https://theijf.org/procurement/t8086_172450_005_56_tc
Federal,INFORMATION TECHNOLOGY AND TELECOMMUNICATIONS CONSULTANTS,Transport Canada,TEKSYSTEMS,"$532,438","Mar. 4, 2021","Apr. 1, 2021","May 31, 2023",https://theijf.org/procurement/t8086_172450_005_57_tc
Federal,"IMAGE/VIDEO COMMUNICATIONS EQUIPMENT (INCLUDES TELEPRESENCE/VIDEO CONFERENCING EQUIPMENT, CABLING, PARTS AND PERIPHERALS)",Transport Canada,TELUS,"$29,434","Mar. 4, 2021","Mar. 4, 2021","Mar. 31, 2021",https://theijf.org/procurement/t8086_202931_tc
Federal,"Communications/Networking equipment (includes analog, digital and combined analog/digital equipment, cabling, parts and peripherals)",National Defence,Motorola Solutins Canada Ltd,"$195,464","Mar. 4, 2021","Mar. 4, 2021","Mar. 31, 2021",https://theijf.org/procurement/w_3332fh_210438_dnd
Federal,Tools and implements,National Defence,NEDCO,"$13,110","Mar. 4, 2021","Mar. 4, 2021","Mar. 31, 2021",https://theijf.org/procurement/w0100_4502229965_dnd
Federal,"Image/Video communications equipment (includes telepresence/video conferencing equipment, cabling, parts and peripherals)",National Defence,Ivan's Camera (2017) Ltd.,"$386,912","Mar. 4, 2021","Mar. 4, 2021","Mar. 31, 2021",https://theijf.org/procurement/w0100_4502230176_dnd
Federal,Computer equipment related to distributed computing environment (DCE)-Desktop/personal/portable (includes all related parts and peripherals),National Defence,Backman Vid Com Ltd,"$15,463","Mar. 4, 2021","Mar. 4, 2021","Mar. 31, 2021",https://theijf.org/procurement/w0100_4502230358_dnd
Federal,Miscellaneous manufactured articles,National Defence,Nikon,"$19,934","Mar. 4, 2021","Mar. 4, 2021","Apr. 28, 2021",https://theijf.org/procurement/w0100_4502230366_dnd
Federal,Gasoline,National Defence,Coastal Mountain Fuels,"$19,578","Mar. 4, 2021","Mar. 4, 2021","Mar. 31, 2021",https://theijf.org/procurement/w0103_4502230585_dnd
Federal,Application software (including COTS) and application development and delivery software,National Defence,ESRI Canada Ltd,"$68,150","Mar. 4, 2021","Mar. 4, 2021","Apr. 5, 2021",https://theijf.org/procurement/w0103_218926_001_vic_dnd
Federal,Miscellaneous Chemical products,National Defence,Corporate Express,"$11,036","Mar. 4, 2021","Mar. 4, 2021","Mar. 30, 2021",https://theijf.org/procurement/w0125_4502230104_dnd
Federal,Miscellaneous Chemical products,National Defence,Staples Professional,"$16,229","Mar. 4, 2021","Mar. 4, 2021","Mar. 31, 2021",https://theijf.org/procurement/w0125_4502230223_dnd
Federal,"Image/Video communications equipment (includes telepresence/video conferencing equipment, cabling, parts and peripherals)",National Defence,DV Shop,"$10,708","Mar. 4, 2021","Mar. 4, 2021","Jun. 29, 2021",https://theijf.org/procurement/w02021_202103_a_dnd
Federal,Other Business services not Elsewhere Specified,National Defence,MLS,"$108,404","Mar. 4, 2021","Mar. 5, 2021","Mar. 7, 2021",https://theijf.org/procurement/w1235211001_dnd
Federal,Other Business services not Elsewhere Specified,National Defence,MLS,"$85,700","Mar. 4, 2021","Mar. 5, 2021","Mar. 7, 2021",https://theijf.org/procurement/w1235211002_dnd
Federal,Ferrous metals,National Defence,EMCO Corporation,"$11,696","Mar. 4, 2021","Mar. 4, 2021","Mar. 31, 2021",https://theijf.org/procurement/w1773_4502229962_dnd
Federal,Computer equipment related to distributed computing environment (DCE)-Desktop/personal/portable (includes all related parts and peripherals),National Defence,Direct Dial,"$16,924","Mar. 4, 2021","Apr. 6, 2021","Apr. 12, 2021",https://theijf.org/procurement/w2665_21_a022_dnd
Federal,License/Maintenance fees for application software (including COTS) and application development and delivery software,National Defence,Prophecy Americas,"$16,628","Mar. 4, 2021","Mar. 4, 2021","Mar. 3, 2022",https://theijf.org/procurement/w3330_21_513_dnd
Federal,License/Maintenance fees for application software (including COTS) and application development and delivery software,National Defence,SDL International Inc,"$41,494","Mar. 4, 2021","Mar. 8, 2021","Mar. 7, 2022",https://theijf.org/procurement/w3330_216618_001_ee_dnd
Federal,Other equipment and Parts,National Defence,QUALITY NDE LIMITED,"$24,854","Mar. 4, 2021","Mar. 4, 2021","Mar. 31, 2021",https://theijf.org/procurement/w3474_4502230423_dnd
Federal,"Measuring, controlling, laboratory, medical and optical equipment and parts",National Defence,OLYMPUS CANADA INC,"$15,764","Mar. 4, 2021","Mar. 4, 2021","Mar. 31, 2021",https://theijf.org/procurement/w3474_4502230488_dnd
Federal,Ships and boats,National Defence,MACKINNON AND OLDING,"$28,351","Mar. 4, 2021","Mar. 8, 2021","Jul. 23, 2021",https://theijf.org/procurement/w3554_4502229937_dnd
Federal,"Office furniture and furnishings, including parts",National Defence,Grand & Toy,"$18,751","Mar. 4, 2021","Mar. 4, 2021","Mar. 31, 2021",https://theijf.org/procurement/w355b_4502229953_dnd
Federal,"Office furniture and furnishings, including parts",National Defence,Mi'Kmaq Office Furniture & Interiors,"$21,218","Mar. 4, 2021","Mar. 4, 2021","Mar. 31, 2021",https://theijf.org/procurement/w355b_4502229988_dnd
Federal,Other machinery and parts,National Defence,Shop3D.ca,"$16,288","Mar. 4, 2021","Mar. 4, 2021","Mar. 31, 2021",https://theijf.org/procurement/w355b_4502230062_dnd
Federal,Information technology and telecommunications consultants,National Defence,Quest Software Canada Inc,"$18,712","Mar. 4, 2021","Mar. 5, 2021","Mar. 31, 2021",https://theijf.org/procurement/w4938_21_360s_dnd
Federal,"Communications/Networking equipment (includes analog, digital and combined analog/digital equipment, cabling, parts and peripherals)",National Defence,Genesis Integration Inc.,"$24,905","Mar. 4, 2021","Mar. 4, 2021","Mar. 31, 2021",https://theijf.org/procurement/w6399_21_lf32c_dnd
Federal,Transportation of things not elsewhere specified,National Defence,Couture Logistics Inc,"$21,000","Mar. 4, 2021","Mar. 10, 2021","Mar. 15, 2021",https://theijf.org/procurement/w6447npcc20_0316_dnd
Federal,"Image/Video communications equipment (includes telepresence/video conferencing equipment, cabling, parts and peripherals)",National Defence,TELUS COMMUNICATIONS COMPANY,"$19,093","Mar. 4, 2021","Mar. 4, 2021","Mar. 30, 2021",https://theijf.org/procurement/w6820_4502230401_dnd
Federal,"Image/Video communications equipment (includes telepresence/video conferencing equipment, cabling, parts and peripherals)",National Defence,DYNAMIX (OTTAWA) INC.,"$36,110","Mar. 4, 2021","Mar. 4, 2021","Mar. 30, 2021",https://theijf.org/procurement/w6820_4502230414_dnd
Federal,Other buildings,National Defence,Liteside Contracting,"$59,325","Mar. 4, 2021","Mar. 4, 2021","Mar. 31, 2021",https://theijf.org/procurement/w684e_4502230477_dnd
Federal,Commercial buildings,National Defence,Nelson Roofing & Sheet Metal Ltd,"$10,283","Mar. 4, 2021","Mar. 4, 2021","Mar. 31, 2021",https://theijf.org/procurement/w6862_4502230220_dnd
Federal,Electric power installations,National Defence,VI Powerline Ltd,"$27,296","Mar. 4, 2021","Mar. 4, 2021","Aug. 5, 2021",https://theijf.org/procurement/w6862_4502230409_dnd
Federal,Other clothing,National Defence,Tenaquip,"$12,743","Mar. 4, 2021","Mar. 4, 2021","Mar. 31, 2021",https://theijf.org/procurement/w7702_4502230609_dnd
Federal,"Inorganic and organic chemicals, including plastics, rubber and products, and excluding tires and tubes",National Defence,FINE SCIENCE TOOLS INC,"$13,532","Mar. 4, 2021","Mar. 4, 2021","Mar. 31, 2021",https://theijf.org/procurement/w7714_4502230551_dnd
Federal,"Printed matter, including books, newspapers, pictures, manuscripts and forms",National Defence,ProQuest LLC,"$49,845","Mar. 4, 2021","Mar. 15, 2021","Mar. 15, 2021",https://theijf.org/procurement/w8160_20_3111_dnd
Federal,Other equipment and Parts,National Defence,JHT Defense Inc.,"$11,025","Mar. 4, 2021","Mar. 4, 2021","Jun. 24, 2021",https://theijf.org/procurement/w8482_4502230227_dnd
Federal,Other equipment and Parts,National Defence,United States Department of Airforce,"$12,474,995","Mar. 4, 2021","Mar. 4, 2021","Mar. 4, 2031",https://theijf.org/procurement/w8484_21ma40_dnd
Federal,"Miscellaneous textiles, headgear, umbrellas, etc.",National Defence,Jonna Sugden DBA Fashion Tags 2016,"$11,821","Mar. 4, 2021","Mar. 4, 2021","Apr. 8, 2021",https://theijf.org/procurement/w8486_4502230158_dnd
Federal,Other equipment and Parts,National Defence,eppendorf canada,"$20,592","Mar. 4, 2021","Mar. 4, 2021","Mar. 31, 2021",https://theijf.org/procurement/w0114_4502230471_dnd
Federal,INFORMATION TECHNOLOGY AND TELECOMMUNICATIONS CONSULTANTS,Statistics Canada,Softchoice Corporation,"$99,892","Mar. 5, 2021","Apr. 1, 2021","Sep. 1, 2021",https://theijf.org/procurement/000012325_statcan
Federal,Other professional services not elswhere specified,Office of the Commissioner of Official Languages,Raymond Chabot Grant Thornton,"$28,698","Mar. 5, 2021","Mar. 8, 2021","May 1, 2021",https://theijf.org/procurement/0p001_20_0177_ocol
Federal,License/Maintenance Fees for Client Software Related to Distributed Computing Environment (DCE) - Desktop and Office                                  ,Statistics Canada,Optiv Canada Federal Inc.,"$109,329","Mar. 5, 2021","Apr. 1, 2021","Dec. 1, 2021",https://theijf.org/procurement/12328_statcan
Federal,Computer equipment related to distributed computing environment (DCE)-Desktop/personal/portable (includes all related parts and peripherals),National Defence,XAV Soloution Inc.,"$155,598","Mar. 5, 2021","Mar. 5, 2021","Apr. 5, 2021",https://theijf.org/procurement/143_dnd
Federal,Recreational Services,Canadian Heritage,PR3 Médias Inc,"$6,548,388","Mar. 5, 2021","Mar. 5, 2021","Oct. 31, 2022",https://theijf.org/procurement/2020034301_pch
Federal,"Electric Lighting, Distribution and Control Equipment and Parts",Parks Canada,REXEL CANADA ELECTRICAL INC.,"$195,487","Mar. 5, 2021","Mar. 5, 2021","May 31, 2021",https://theijf.org/procurement/2020039200_pc
Federal,Research Contracts,Canadian Heritage,"IPSOS PUBLIC AFFAIRS, LLC","$65,000","Mar. 5, 2021","Mar. 5, 2021","Sep. 30, 2021",https://theijf.org/procurement/2020060901_pch
Federal,Computer equipment related to Distributed Computing Environment (DCE) - Desktop/personal/portable (includes all related parts and peripherals),Canada Revenue Agency,Hypertec Systems Inc.,"$20,160","Mar. 5, 2021","Mar. 5, 2021","Mar. 31, 2021",https://theijf.org/procurement/2021002637_cra
Federal,Training Consultants,Canada Border Services Agency,"Prosci Canada, ULC","$42,699","Mar. 5, 2021","Mar. 9, 2021","Mar. 31, 2021",https://theijf.org/procurement/2021002640_cbsa
Federal,Tuition Fees and Costs of Attending Courses Including Seminars not Elsewhere Specified,Canada Border Services Agency,The Royal Canadian Marine,"$13,125","Mar. 5, 2021","Mar. 5, 2021","Mar. 31, 2021",https://theijf.org/procurement/2021002645_cbsa
Federal,"Measuring, controlling, laboratory, medical and optical equipment and parts",Environment and Climate Change Canada,ILLUMINA CANADA ULC,"$392,111","Mar. 5, 2021","Mar. 5, 2021","Mar. 31, 2024",https://theijf.org/procurement/20210456a_ec
Federal,"Electric lighting, distribution and control equipment and Parts",Natural Resources Canada,CONVIRON,"$57,935","Mar. 5, 2021","Mar. 5, 2021","Jun. 4, 2022",https://theijf.org/procurement/20210810a_nrcan
Federal,Radar equipment and parts,Environment and Climate Change Canada,LEONARDO GERMANY GMBH,"$156,230","Mar. 5, 2021","Mar. 5, 2021","Mar. 31, 2022",https://theijf.org/procurement/20210858a_ec
Federal,Data and database access services,"Innovation, Science and Economic Development Canada",EUROMONITOR INTERNATIONAL,"$36,292","Mar. 5, 2021","Mar. 5, 2021","Mar. 4, 2022",https://theijf.org/procurement/2035547_ic
Federal,Data and database access services,"Innovation, Science and Economic Development Canada",JLR INC.,"$30,641","Mar. 5, 2021","Mar. 5, 2021","Mar. 4, 2022",https://theijf.org/procurement/2035580_ic
Federal,Electronic subscriptions and electronic publications,"Innovation, Science and Economic Development Canada","CRAIN COMMUNICATIONS, INC.","$19,013","Mar. 5, 2021","Mar. 5, 2021","Mar. 4, 2022",https://theijf.org/procurement/2035591_ic
Federal,Aviation fuel,National Defence,Shell Aviation,"$11,960","Mar. 5, 2021","Mar. 5, 2021","Mar. 5, 2021",https://theijf.org/procurement/2106029339_dnd
Federal,Aviation fuel,National Defence,AEG,"$107,731","Mar. 5, 2021","Mar. 5, 2021","Mar. 5, 2021",https://theijf.org/procurement/2106029679_dnd
Federal,Aviation fuel,National Defence,AEG,"$17,397","Mar. 5, 2021","Mar. 5, 2021","Mar. 5, 2021",https://theijf.org/procurement/2106029685_dnd
Federal,Aviation fuel,National Defence,WORLD FUEL SERVICES,"$10,939","Mar. 5, 2021","Mar. 5, 2021","Mar. 5, 2021",https://theijf.org/procurement/2106037930_dnd
Federal,Aviation fuel,National Defence,WORLD FUEL SERVICES,"$10,057","Mar. 5, 2021","Mar. 5, 2021","Mar. 5, 2021",https://theijf.org/procurement/2106038060_dnd
Federal,Aviation fuel,National Defence,WORLD FUEL SERVICES,"$10,721","Mar. 5, 2021","Mar. 5, 2021","Mar. 5, 2021",https://theijf.org/procurement/2106038251_dnd
Federal,Aviation fuel,National Defence,WORLD FUEL SERVICES,"$10,148","Mar. 5, 2021","Mar. 5, 2021","Mar. 5, 2021",https://theijf.org/procurement/2106038259_dnd
Federal,Aviation fuel,National Defence,WORLD FUEL SERVICES,"$10,910","Mar. 5, 2021","Mar. 5, 2021","Mar. 5, 2021",https://theijf.org/procurement/2106038376_dnd
Federal,"Inorganic and organic chemicals, including plastics, rubber and products, and excluding tires and tubes",National Defence,DETON CHO LOGISTICS,"$13,803","Mar. 5, 2021","Mar. 5, 2021","Mar. 6, 2021",https://theijf.org/procurement/2106058767_dnd
Federal,Aviation fuel,National Defence,UQSUQ,"$17,099","Mar. 5, 2021","Mar. 5, 2021","Mar. 5, 2021",https://theijf.org/procurement/2106074735_dnd
Federal,Welfare Services,Correctional Service of Canada,CONNECTIVE SUPPORT SOCIETY,"$3,960,011","Mar. 5, 2021","Apr. 1, 2021","Mar. 31, 2023",https://theijf.org/procurement/21120_21_3710870_csc
Federal,Other Professional Services not Elsewhere Specified,Correctional Service of Canada,MCVICAR BRIAN,"$45,199","Mar. 5, 2021","Mar. 8, 2021","Mar. 7, 2022",https://theijf.org/procurement/21120_21_3726731_csc
Federal,"Measuring, Controlling, Laboratory, Medical and Optical Equipment and Parts",Correctional Service of Canada,HARDING MEDICAL SUPPLIES NB LTD,"$33,293","Mar. 5, 2021","Mar. 5, 2021","Mar. 31, 2021",https://theijf.org/procurement/21201_21_3726352_csc
Federal,Other Engineering Installations,Correctional Service of Canada,ENTREPRISE VAILLANT 1994,"$36,909","Mar. 5, 2021","Mar. 5, 2021","Mar. 31, 2021",https://theijf.org/procurement/21301_21_3589725_7_csc
Federal,Engineering Consultants - Construction,Correctional Service of Canada,LEVESQUE PATRICE  INGENIEUR,"$11,488","Mar. 5, 2021","Mar. 5, 2021","Mar. 31, 2021",https://theijf.org/procurement/21301_21_3722522_1_csc
Federal,"Miscellaneous Food, Food Materials and Food Preparations, Including Beverages and Tobacco",Correctional Service of Canada,CHEF BRANDZ INC,"$24,498","Mar. 5, 2021","Mar. 5, 2021","Mar. 31, 2021",https://theijf.org/procurement/21342_21_3761546_csc
Federal,Pharmaceutical and Other Medicinal Products,Correctional Service of Canada,MCKESSON CANADA CORPORATION,"$11,552","Mar. 5, 2021","Mar. 5, 2021","Mar. 31, 2021",https://theijf.org/procurement/21368_20_3761611_csc
Federal,Protection Services,Correctional Service of Canada,CORPS CANADIEN DES COMMISSIONNAIRES,"$36,983","Mar. 5, 2021","Mar. 5, 2021","Mar. 31, 2021",https://theijf.org/procurement/21390_21_3761632_csc
Federal,Pharmaceutical and Other Medicinal Products,Correctional Service of Canada,MCKESSON CANADA CORPORATION,"$22,350","Mar. 5, 2021","Mar. 5, 2021","Mar. 31, 2021",https://theijf.org/procurement/21401_21_3761616_csc
Federal,Pharmaceutical and Other Medicinal Products,Correctional Service of Canada,MCKESSON CANADA CORPORATION,"$312,000","Mar. 5, 2021","Mar. 5, 2021","Mar. 31, 2021",https://theijf.org/procurement/21401_21_3761650_csc
Federal,Miscellaneous Chemical Products,Correctional Service of Canada,VERITIV CANADA INC,"$24,868","Mar. 5, 2021","Mar. 6, 2021","Mar. 31, 2021",https://theijf.org/procurement/21423_21_3761592_csc
Federal,Physicians and Surgeons,Correctional Service of Canada,BROWN JASON D,"$53,708","Mar. 5, 2021","Apr. 1, 2021","Mar. 31, 2024",https://theijf.org/procurement/21470_22_3591892_csc
Federal,"House Furnishing, excl. Furniture",Correctional Service of Canada,SWS DETENTION GROUP INC,"$22,914","Mar. 5, 2021","Mar. 5, 2021","Mar. 31, 2021",https://theijf.org/procurement/21504_21_3761550_csc
Federal,"Miscellaneous Food, Food Materials and Food Preparations, Including Beverages and Tobacco",Correctional Service of Canada,MEDALLION MILK CO LTD,"$22,424","Mar. 5, 2021","Mar. 5, 2021","Mar. 31, 2021",https://theijf.org/procurement/21510_21_3761439_csc
Federal,Other Equipment and Parts,Correctional Service of Canada,ACKLANDS GRAINGER INC,"$16,762","Mar. 5, 2021","Mar. 5, 2021","Mar. 31, 2021",https://theijf.org/procurement/21520_21_3761697_csc
Federal,Processing Machinery,Correctional Service of Canada,FINNING INTERNATIONAL INC,"$11,711","Mar. 5, 2021","Mar. 5, 2021","Mar. 31, 2021",https://theijf.org/procurement/21537_21_3761652_csc
Federal,Institutional Buildings,Correctional Service of Canada,WHEELCHAIR WORKS,"$20,076","Mar. 5, 2021","Mar. 5, 2021","Mar. 31, 2021",https://theijf.org/procurement/21831_21_3761811_csc
Federal,Protection Services,Correctional Service of Canada,CANADIAN CORPS OF COMMISSIONAIRES,"$10,837","Mar. 5, 2021","Apr. 1, 2021","Mar. 31, 2022",https://theijf.org/procurement/21880_22_3772441_csc
Federal,Protection Services,Correctional Service of Canada,CANADIAN CORPS OF COMMISSIONAIRES,"$512,007","Mar. 5, 2021","Apr. 1, 2021","Mar. 31, 2022",https://theijf.org/procurement/21880_22_3772608_csc
Federal,Miscellaneous Manufactured Articles,Correctional Service of Canada,2678868 ONTARIO INC,"$12,293","Mar. 5, 2021","Mar. 5, 2021","Mar. 31, 2021",https://theijf.org/procurement/21t40139_21_3761576_csc
Federal,Other Business Services not Elsewhere Specified,Correctional Service of Canada,ENVIRONMENTAL 360 SOLUTIONS LTD,"$28,250","Mar. 5, 2021","Mar. 5, 2021","Mar. 31, 2021",https://theijf.org/procurement/21t46039_21_3761674_csc
Federal,Management consulting,Treasury Board of Canada Secretariat,Institute on Governance,"$30,800","Mar. 5, 2021","Mar. 5, 2021","Mar. 31, 2021",https://theijf.org/procurement/2406221280_tbs
Federal,License/Maintenance fees for application software (including COTS) and application development and delivery software,Treasury Board of Canada Secretariat,Deloitte Inc.,"$172,275","Mar. 5, 2021","Mar. 5, 2021","Mar. 4, 2022",https://theijf.org/procurement/2406221336_tbs
Federal,"Measuring, controlling, laboratory, medical and optical instruments, apparatus and accessories","Innovation, Science and Economic Development Canada","RICE LAKE WEIGHING SYSTEMS, INC.","$18,761","Mar. 5, 2021","Mar. 5, 2021","Apr. 30, 2021",https://theijf.org/procurement/2532352_ic
Federal,License/Maintenance fees for client software related to Distributed Computing Environment (DCE),Shared Services Canada,DELOITTE INC.,"$326,308","Mar. 5, 2021","Mar. 5, 2021","Mar. 4, 2022",https://theijf.org/procurement/2b0kbq0237_ssc
Federal,Computer equipment related to distributed computing environment (DCE)-Desktop/personal/portable (includes all related parts and peripherals),National Defence,PureSpirit Solutions Inc.,"$463,110","Mar. 5, 2021","Mar. 5, 2021","Mar. 31, 2021",https://theijf.org/procurement/2bh085400_dnd
Federal,Application software (including COTS) and application development and delivery software,National Defence,Avant Systems Group,"$10,290","Mar. 5, 2021","Mar. 25, 2021","Mar. 25, 2022",https://theijf.org/procurement/2bs_0_82482_dnd
Federal,"Computer equipment related to production and operations (P&O) environment-All servers, storage, printers, etc. (includes all related parts and peripherals)",National Defence,ADVANCED CHIPPEWA TECHNOLOGIES INC,"$2,235,138","Mar. 5, 2021","Mar. 5, 2021","Mar. 31, 2021",https://theijf.org/procurement/2bscs12235_dnd
Federal,"Measuring, controlling, laboratory, medical and optical equipment and parts",Canadian Food Inspection Agency,MANDEL SCIENTIFIC COMPANY INC.,"$17,330","Mar. 5, 2021","Mar. 5, 2021","Mar. 31, 2021",https://theijf.org/procurement/3000723475_cfia
Federal,Accounting and audit services,Canadian Nuclear Safety Commission,BDO CANADA LLP,"$21,188","Mar. 5, 2021","Mar. 8, 2021","May 31, 2021",https://theijf.org/procurement/3000723560_cnsc
Federal,Management consulting,Agriculture and Agri-Food Canada,GOSS GILROY INC,"$11,300","Mar. 5, 2021","Mar. 5, 2021","Mar. 31, 2021",https://theijf.org/procurement/3000723603_aafc
Federal,Other engineering works,Environment and Climate Change Canada,REESOR'S GROUP LTD,"$39,900","Mar. 5, 2021","Mar. 5, 2021","Apr. 1, 2023",https://theijf.org/procurement/3000723679_ec
Federal,"Measuring, controlling, laboratory, medical and optical equipment and parts",Natural Resources Canada,LEICA MICROSYSTEMS CANADA,"$30,986","Mar. 5, 2021","Mar. 5, 2021","Mar. 31, 2021",https://theijf.org/procurement/3000723681_nrcan
Federal,Tuition fees and costs of attending courses including seminars not elsewhere specified,Environment and Climate Change Canada,ECOLE DE LANGUES LA CITE,"$191,242","Mar. 5, 2021","Mar. 5, 2021","Mar. 31, 2024",https://theijf.org/procurement/3000723682_ec
Federal,"Electric lighting, distribution and control equipment and Parts",Environment and Climate Change Canada,CANADIAN MILL NETTCLEAN SUPPLY INC.,"$23,080","Mar. 5, 2021","Mar. 5, 2021","Jun. 30, 2021",https://theijf.org/procurement/3000723700_ec
